<?xml version="1.0" encoding="UTF-8"?>
<!-- ex03-2 XSD -->
<xs:schema xmlns:xs="http://www.w3.org/2001/XMLSchema">
    <xs:element name="employees">
        <xs:complexType>
            <xs:sequence>
                <xs:element name="employee" type="employee_type" minOccurs="1" maxOccurs="unbounded" />
            </xs:sequence>
        </xs:complexType>
    </xs:element>

    <xs:complexType name="employee_type">
        <xs:sequence>
            <xs:element name="name" type="xs:string"></xs:element>
            <xs:element name="age" type="xs:string" minOccurs="1" maxOccurs="unbounded"></xs:element>
            <xs:element name="sex" type="xs:string" minOccurs="0"></xs:element>
            <xs:element name="address" type="xs:string"></xs:element>
        </xs:sequence>
        <xs:attribute name="pid" use="required">
            <xs:simpleType>
                <xs:restriction base="xs:string">
                    <xs:pattern value="[A-Z]\d{9}"></xs:pattern>
                </xs:restriction>
            </xs:simpleType>
        </xs:attribute>
    </xs:complexType>
</xs:schema>